,text,party_size_number,spatial_relation,facility,timeRange,sort,country,party_size_description,restaurant_type,restaurant_name,cuisine,served_dish,state,poi,city
944,Please call and reserve seating for march 6 at a diner in Kyrgyzstan,,,,march 6,,Kyrgyzstan,,diner,,,,,,
945,I need to book a popular  pastelaria  restaurant in Svalbard and Jan Mayen for a party of eight,eight,,,,popular,Svalbard and Jan Mayen,,restaurant,,pastelaria,,,,
946,Book a table for seven in a pub in Iraq which offers gluten free food about 141 days from now .,seven,,,141 days from now,,Iraq,,pub,,gluten free,,,,
947,"I need to book a restaurant in Fork Mountain , SC for valarie, mari and I",,,,,,,"valarie, mari and I",restaurant,,,,SC,,Fork Mountain
948,Can you get a table at The Triple Door in District Of Columbia for me and deborah vasquez ,,,,,,,me and deborah vasquez,,The Triple Door,,,District Of Columbia,,
949,I need a reservation in 1 second in Atlas with a party of nine,nine,,,in 1 second,,,,,,,,,,Atlas
950,"I need a reservation, looking for a place with pool at Midnight in a pub .",,,pool,Midnight,,,,pub,,,,,,
951,book a popular  food truck in Kentucky,,,,,popular,,,food truck,,,,Kentucky,,
952,I want to find a restaurant that has a table for two at 5 AM,two,,,5 AM,,,,restaurant,,,,,,
953,Book me a pizzeria that serves oreo for eight,eight,,,,,,,pizzeria,,,oreo,,,
954,I need a reservation for a highly rated  goiano  restaurant in AR,,,,,highly rated,,,restaurant,,goiano,,AR,,
955,book for crepes at a restaurant in Sint Maarten,,,,,,Sint Maarten,,restaurant,,,crepes,,,
956,Find a table at a restaurant in Bynum  CA at 09:59 PM,,,,09:59 PM,,,,restaurant,,,,CA,,Bynum
957,book a bar with mediterranean food for three people,three,,,,,,,bar,,mediterranean,,,,
958,I'd like a table at the San Francisco Brewing Company in Puerto Rico at noon,,,,noon,,,,,San Francisco Brewing Company,,,Puerto Rico,,
959,book a spot at Savoy Hotel and Grill that is neighboring  Wisconsin,,neighboring,,,,,,,Savoy Hotel and Grill,,,Wisconsin,,
960,"Book a table at Dillard House in Exell , IA",,,,,,,,,Dillard House,,,IA,,Exell
961,Book a taverna in Wisconsin for 22:54 .,,,,22:54,,,,taverna,,,,Wisconsin,,
962,Book reservations at a tea house in Lodi with my granddaughter and I,,,,,,,my granddaughter and I,tea house,,,,,,Lodi
963,I want to book a cafeteria in El Reno that serves javanese,,,,,,,,cafeteria,,javanese,,,,El Reno
964,book now at a bakery at a spa,,,spa,now,,,,bakery,,,,,,
965,I need a table somewhere in Culver City  WA,,,,,,,,,,,,WA,,Culver City
966,I want to book a restaurant in Botswana for four people.,four,,,,,Botswana,,restaurant,,,,,,
967,I need to book a table at brasserie for 10 that is highly rated in Kentucky,10,,,,highly rated,,,brasserie,,,,Kentucky,,
968,book a table for nine PM at a pub in MA,,,,nine PM,,,,pub,,,,MA,,
969,Book a restaurant  around  Thompson,,around,,,,,,restaurant,,,,,Thompson,
970,I need reservations at Khedive Palace that's close  in town .,,close,,,,,,,Khedive Palace,,,,in town,
971,I need a reservation for Blue Ribbon Barbecue  far from NY for a party of 10,10,far,,,,,,,Blue Ribbon Barbecue,,,NY,,
972,"book a spa in pizzeria on November 24, 2036",,,spa,"November 24, 2036",,,,pizzeria,,,,,,
973,book a highly rated  bar in Burkina for georgia and I,,,,,highly rated,Burkina,georgia and I,bar,,,,,,
974,Need a booking for 6 in OK for the city of Boonton,6,,,,,,,,,,,OK,,Boonton
975,Book a popular  joint in Ocean Gate for seven people at elevenses .,seven,,,elevenses,popular,,,joint,,,,,,Ocean Gate
976,"I would like to book a fry sauce  bar for jul. 3, 2019",,,,"jul. 3, 2019",,,,bar,,,fry sauce,,,
977,Book a restaurant in the Dominican Republic  in one minute for a party of eight,eight,,,in one minute,,Dominican Republic,,restaurant,,,,,,
978,Book a restaurant in Donnelly,,,,,,,,restaurant,,,,,,Donnelly
979,book a spot for 3 in MT,3,,,,,,,,,,,MT,,
980,Book a reservation for a gastropub serving liver and onions,,,,,,,,gastropub,,,liver and onions,,,
981,I need a table in East Timor for a party of nine at 5 North St,nine,,,,,East Timor,,,5 North St,,,,,
982,Please book me a table for next week at a top-rated  restaurant,,,,next week,top-rated,,,restaurant,,,,,,
983,I want top-rated  veneto cuisine at a restaurant in Antietam for 2 .,2,,,,top-rated,,,restaurant,,veneto,,,,Antietam
984,Book a restaurant for four people in Wylliesburg .,four,,,,,,,restaurant,,,,,,Wylliesburg
985,book a spot for six at a restaurant that serves fish and chips,six,,,,,,,restaurant,,,fish and chips,,,
986,I'm in Tuolumne City and want fast food for a party of eight ,eight,,,,,,,fast food,,,,,,Tuolumne City
987,book a table in Sterling Run for two with a pool and food court,two,,pool,,,,,food court,,,,,,Sterling Run
988,Book a reservation for Can Fabes  nearby  Namibia,,nearby,,,,Namibia,,,Can Fabes,,,,,
989,"On june 27, 2026 I'd like to go to a Delaware  gastropub",,,,"june 27, 2026",,,,gastropub,,,,Delaware,,
990,"Need a table for rita, antoinette and I",,,,,,,"rita, antoinette and I",,,,,,,
991,"make a reservation for hillary, dina chavez and alexis",,,,,,,"hillary, dina chavez and alexis",,,,,,,
992,Book me a table for five at the top-rated  Morocco  restaurant .,five,,,,top-rated,Morocco,,restaurant,,,,,,
993,Find a reservation for three at a top-rated  restaurant,three,,,,top-rated,,,restaurant,,,,,,
994,Book a restaurant in Satanta that has highly rated  northeastern for 10,10,,,,highly rated,,,restaurant,,northeastern,,,,Satanta
995,Book a reservation for City Tavern in Long Bridge,,,,,,,,,City Tavern,,,,,Long Bridge
996,Book a table for pearl and verna slated ash wednesday in Gabon .,,,,ash wednesday,,Gabon,pearl and verna,,,,,,,
997,Book a food truck that is highly rated in Honduras,,,,,highly rated,Honduras,,food truck,,,,,,
998,Find me a table for 8 somewhee in Hollenberg  in nine weeks ,8,,,in nine weeks,,,,,,,,,,Hollenberg
999,Book a table at Laurie Beechman Theatre for a party of 4 in Utah,4,,,,,,,,Laurie Beechman Theatre,,,Utah,,
1000,I would like to book at Clinton Street Baking Company & Restaurant in Brookneal .,,,,,,,,,Clinton Street Baking Company & Restaurant,,,,,Brookneal
1001,book a table for me and my step uncle in Malta at a cafeteria,,,,,,Malta,me and my step uncle,cafeteria,,,,,,
1002,I want to eat somewhere that is faraway from Iowa .,,faraway,,,,,,,,,,Iowa,,
1003,2 of us want to eat at a restaurant that serves meatballs in VT,2,,,,,,,restaurant,,,meatballs,VT,,
1004,Book the Space Aliens Grill & Bar in Hord  WY for Feb. the twenty-seventh .,,,,Feb. the twenty-seventh,,,,,Space Aliens Grill & Bar,,,WY,,Hord
1005,book a spot for 3 in Egypt at five,3,,,five,,Egypt,,,,,,,,
1006,"Please book a restaurant for party of 1 in Seeley Lake on july the fourteenth, 2022 .",1,,,"july the fourteenth, 2022",,,,restaurant,,,,,,Seeley Lake
1007,I want to book a cafeteria for 4 that has meze,4,,,,,,,cafeteria,,,meze,,,
1008,need a table for nine in East Prairie  LA,nine,,,,,,,,,,,LA,,East Prairie
1009,book me a restaurant for 4 members at Beaman  Federated States Of Micronesia  in one minute ,4,,,in one minute,,,,restaurant,,,,Federated States Of Micronesia,,Beaman
1010,Need to book a reservtion for a restaurant in Maryland for me and my half sister,,,,,,,me and my half sister,restaurant,,,,Maryland,,
1011,I'd like to eat at a pho  restaurant in VT,,,,,,,,restaurant,,,pho,VT,,
1012,I want to make a reservation for one at a sushi  restaurant in Brucetown,one,,,,,,,restaurant,,,sushi,,,Brucetown
1013,table for nine at an internet  pub,nine,,internet,,,,,pub,,,,,,
1014,I want to book a bar  neighboring  our apartment .,,neighboring,,,,,,bar,,,,,our apartment,
1015,"book a table not far in WY at a gastropub with internet for me, jenny and antoinette  in one week",,not far,internet,in one week,,,"me, jenny and antoinette",gastropub,,,,WY,,
1016,book sot for one at restaurant with wifi,one,,wifi,,,,,restaurant,,,,,,
1017,I need to book a table at The Star Inn that's within walking distance from my place in Ashland,,within walking distance,,,,,,,The Star Inn,,,,,Ashland
1018,I need to book a restaurant for 6 people.,6,,,,,,,restaurant,,,,,,
1019,Book me a reservation for a bar that serves lobster roll in OR,,,,,,,,bar,,,lobster roll,OR,,
1020,I want to book a restaurant with creamed eggs on toast on Kansas Day  within walking distance of British Indian Ocean Territory,,within walking distance,,Kansas Day,,British Indian Ocean Territory,,restaurant,,,creamed eggs on toast,,,
1021,I want a table to seat 10 at a close-by to Ottumwa that serves osteria and ranch dressing .,10,close-by,,,,,,osteria,,,ranch dressing,,,Ottumwa
1022,I would like to book the best  food court with persian food within the same area as OK for my ex husband and I ,,within the same area,,,best,,my ex husband and I,food court,,persian,,OK,,
1023,Book a table at a bar in Argentina .,,,,,,Argentina,,bar,,,,,,
1024,book a spot for nine at a top-rated  brasserie that has swiss  within the same area of New York,nine,within the same area,,,top-rated,,,brasserie,,swiss,,New York,,
1025,book a table this evening in Saint Vincent and the Grenadines at a gastropub,,,,evening,,Saint Vincent and the Grenadines,,gastropub,,,,,,
1026,book a table in Hallwood for one for supper,one,,,supper,,,,,,,,,,Hallwood
1027,I want to eat panisses the nearby  cafeteria in Naytahwaush,,nearby,,,,,,cafeteria,,,panisses,,,Naytahwaush
1028,Book a table at a osteria type restaurant in SD,,,,,,,,restaurant,,,,SD,,
1029,Book a table for kristina and teresa  in 1 second .,,,,in 1 second,,,kristina and teresa,,,,,,,
1030,I want to book The Commons Restaurant for five on Dec. the eighth,five,,,Dec. the eighth,,,,,The Commons Restaurant,,,,,
1031,Book the CityZen for six people.,six,,,,,,,,CityZen,,,,,
1032,"Please get me seating at the tavern in Red Lick , Michigan",,,,,,,,tavern,,,,Michigan,,Red Lick
1033,"Need to book a table at a fast food restaurant for a party of nine on November seventeenth, 2019",nine,,,"November seventeenth, 2019",,,,fast food,,,,,,
1034,I want to eat at a bakery with deidre and rosa in Jersey .,,,,,,Jersey,deidre and rosa,bakery,,,,,,
1035,Book a restaurant for ten people 1 second from now .,ten,,,1 second from now,,,,restaurant,,,,,,
1036,"Book reservations for ava gonzales, raquel brown and I on Jul. 6, 2040 in Hainesville at a restaurant",,,,"Jul. 6, 2040",,,"ava gonzales, raquel brown and I",restaurant,,,,,,Hainesville
1037,I need to get seats for me and my ex wife to eat in Egypt .,,,,,,Egypt,me and my ex wife,,,,,,,
1038,book The Lake House for me and carmella,,,,,,,me and carmella,,The Lake House,,,,,
1039,Find a reservation at a brasserie restaurant  nearby  SC for a party of ten,ten,nearby,,,,,,brasserie restaurant,,,,SC,,
1040,antoinette and I want to eat at an oyster bar that serves pizzette in South Duxbury  ME,,,,,,,antoinette and I,oyster bar,,,pizzette,ME,,South Duxbury
1041,"Book a restaurant in Medford Lakes on Sep. 8, 2033 for essie, tonya and I",,,,"Sep. 8, 2033",,,"essie, tonya and I",restaurant,,,,,,Medford Lakes
1042,book a restaurant for four in Burundi,four,,,,,Burundi,,restaurant,,,,,,
1043,"I'd like a table for my teenager and I at the Washington, D.C. Jewish Community Center",,,,,,,my teenager and I,,"Washington, D.C. Jewish Community Center",,,,,
1044,Book a table for doris and I in New Tulsa,,,,,,,doris and I,,,,,,,New Tulsa
1045,"Book a reservation at a restaurant with me, matilda and deana",,,,,,,"me, matilda and deana",restaurant,,,,,,
1046,Reserve a place to eat on march fifteenth in China  within the same area .,,within the same area,,march fifteenth,,China,,,,,,,,
1047,"I'd like a table for three at Black Rapids Roadhouse on February 24th, 2039",three,,,"February 24th, 2039",,,,,Black Rapids Roadhouse,,,,,
1048,Get me a table at a bar which has a spa .,,,spa,,,,,bar,,,,,,
1049,Please make reservations for a bar  close-by in Lake Alfred .,,close-by,,,,,,bar,,,,,,Lake Alfred
1050,I need a reservation for Roscoff Restaurant in Valley Mills,,,,,,,,,Roscoff Restaurant,,,,,Valley Mills
1051,I need a table at a brasserie in Belgium,,,,,,Belgium,,brasserie,,,,,,
1052,I want to book at a pub with parking in Cuba .,,,parking,,,Cuba,,pub,,,,,,
1053,book a table for 4 at Fish Express,4,,,,,,,,Fish Express,,,,,
1054,"I'd like to eat at a top-rated place on nov. the twenty-sixth in the food court , I need reservations for 7 in the city of Kane or somewhere near there.",7,near,,nov. the twenty-sixth,top-rated,,,food court,,,,,,Kane
1055,Book me a table for seven in neighboring  France .,seven,neighboring,,,,France,,,,,,,,
1056,book in Falkland Islands at Atomic Cafe,,,,,,Falkland Islands,,,Atomic Cafe,,,,,
1057,I want to take four friends to the pub for some tuna casserole,four,,,,,,,pub,,,tuna casserole,,,
1058,I need a reservation in Decaturville for six people.,six,,,,,,,,,,,,,Decaturville
1059,Book me a reservation for eight for the top-rated  bakery  eleven hours from now in Mango,eight,,,eleven hours from now,top-rated,,,bakery,,,,,,Mango
1060,book a spot for ten at a restaurant with a spa in U.S. Minor Outlying Islands,ten,,spa,,,U.S. Minor Outlying Islands,,restaurant,,,,,,
1061,Book a reservation for seven people at a highly rated  restaurant that serves moroccan food in East Greenville,seven,,,,highly rated,,,restaurant,,moroccan,,,,East Greenville
1062,Book the Light Horse Tavern for 4 people.,4,,,,,,,,Light Horse Tavern,,,,,
1063,book a table in UT at Kearney for 6,6,,,,,,,,,,,UT,,Kearney
1064,book a table at a restaurant in Lucerne Valley that serves chicken nugget,,,,,,,,restaurant,,,chicken nugget,,,Lucerne Valley
1065,me and deanna want to book a restaurant in Malawi,,,,,,Malawi,me and deanna,restaurant,,,,,,
1066,"Book a food truck that serves tarte for tanisha, lorena and juliana .",,,,,,,"tanisha, lorena and juliana",food truck,,,tarte,,,
1067,"christie, concepcion and I want to eat trattoria at a brasserie in Johnston  now",,,,now,,,"christie, concepcion and I",brasserie,,trattoria,,,,Johnston
1068,book in one hour  within walking distance of a restaurant  downtown,,within walking distance,,in one hour,,,,restaurant,,,,,downtown,
1069,I need to book a top-rated  steakhouse  this Autumn for 1  around  Azerbaijan,1,around,,this Autumn,top-rated,Azerbaijan,,steakhouse,,,,,,
1070,book in Romania for christian and susana at David Carpenter House,,,,,,Romania,christian and susana,,David Carpenter House,,,,,
1071,book in Ukraine at a highly rated  restaurant,,,,,highly rated,Ukraine,,restaurant,,,,,,
1072,Let me get reservations at a place neighboring  Indonesia on August the nineteenth .,,neighboring,,August the nineteenth,,Indonesia,,,,,,,,
1073,I'd like to book a reservation for next Spring for nine people at Shore Club .,nine,,,next Spring,,,,,Shore Club,,,,,
1074,"Book the Chapter One in Bosnia and Herzegovina for patti, hester richardson and camille",,,,,,Bosnia and Herzegovina,"patti, hester richardson and camille",,Chapter One,,,,,
1075,Book me a restaurant  ten minutes from now,,,,ten minutes from now,,,,restaurant,,,,,,
1076,I need a reservation for a tea house in Maple Glen for four people,four,,,,,,,tea house,,,,,,Maple Glen
1077,I'd like to eat at ten PM. anywhere neighboring to our house,,neighboring,,ten PM.,,,,,,,,,our house,
1078,Book a table for seven people at a restaurant which has internet .,seven,,internet,,,,,restaurant,,,,,,
1079,"Book a table for 6 at a restaurant in Pershing Square, Manhattan at two am",6,,,two am,,,,restaurant,"Pershing Square, Manhattan",,,,,
1080,"Book a restaurant in Nebraska on january 25, 2034 for me and my mommy .",,,,"january 25, 2034",,,me and my mommy,restaurant,,,,Nebraska,,
1081,book a restaurant table at the food court in the spa  sixteen hours from now,,,spa,sixteen hours from now,,,,food court,,,,,,
1082,Book me a table for one at Blue Ribbon Barbecue,one,,,,,,,,Blue Ribbon Barbecue,,,,,
1083,Book a highly rated  food court for 2 people on jul. 4th .,2,,,jul. 4th,highly rated,,,food court,,,,,,
1084,"Locate a bakery in Rockport , Federated States Of Micronesia that serves olives",,,,,,,,bakery,,,olives,Federated States Of Micronesia,,Rockport
1085,"Book a table for my great grandfather and I at a place in Booker , AK .",,,,,,,my great grandfather and I,,,,,AK,,Booker
1086,book a table at Anstruther Fish Bar in FM,,,,,,,,,Anstruther Fish Bar,,,FM,,
1087,Please make a reservation at ten at a bakery which serves burrito .,ten,,,,,,,bakery,,,burrito,,,
1088,Book the Labworth Café in Ethiopia for six people.,six,,,,,Ethiopia,,,Labworth Café,,,,,
1089,I have a party of 7 in East Timor,7,,,,,East Timor,,,,,,,,
1090,I need a table for 1 minute from now at any pub for five  around  IN that also serves fisn'n chips .,five,around,,1 minute from now,,,,pub,,,fisn'n chips,IN,,
1091,book a best  tavern for nine,nine,,,,best,,,tavern,,,,,,
1092,me and aisha and craving cordon bleu and need to book a table at a brasserie .,,,,,,,me and aisha,brasserie,,,cordon bleu,,,
1093,evangeline and petra cooper want to go to a restaurant  in 9 years ,,,,in 9 years,,,evangeline and petra cooper,restaurant,,,,,,
1094,Table for one somewhere in Palco,one,,,,,,,,,,,,,Palco
1095,I need to book a restaurant at four o'clock for 4,4,,,four o'clock,,,,restaurant,,,,,,
1096,Lets go to a steakhouse before we go to the pool,,,pool,we,,,,steakhouse,,,,,,
1097,"Book a table for iris, ina and heidi around 9 pm .",,,,9 pm,,,"iris, ina and heidi",,,,,,,
1098,I need a reservation in Pitcairn Islands for any restaurant  joint,,,,,,Pitcairn Islands,,restaurant  joint,,,,,,
1099,Book something for me and my wife at a restaurant  in four weeks,,,,in four weeks,,,me and my wife,restaurant,,,,,,
1100,Need a table in Serbia and Montenegro on Apr. 16 for a party of seven,seven,,,Apr. 16,,Serbia and Montenegro,,,,,,,,
1101,Book a steakhouse with a spa for seven people.,seven,,spa,,,,,steakhouse,,,,,,
1102,I need seats for six at a vegan  bar in London Borough of Enfield or the same distant  in one second,six,same distant,,in one second,,,,bar,,,vegan,,London Borough of Enfield,
1103,Book a table at a diner which serves thousand island dressing in Ivory Coast .,,,,,,Ivory Coast,,diner,,,thousand island dressing,,,
1104,I need a booking for seven people at Metropolitan Museum of Art .,seven,,,,,,,,Metropolitan Museum of Art,,,,,
1105,Book a reservation for four at the best  brasserie in Venezuela,four,,,,best,Venezuela,,brasserie,,,,,,
1106,Book a table for 1 person at a popular  brasserie in Jansen that serves english food,1,,,,popular,,,brasserie,,english,,,,Jansen
1107,I need a reservation for eight for a brasserie that serves spanish rice,eight,,,,,,,brasserie,,,spanish rice,,,
1108,"Book reservations at a restaurant in NE for 4 people on apr. 2, 2021",4,,,"apr. 2, 2021",,,,restaurant,,,,NE,,
1109,book a gratin serving tea house in Bushkill,,,,,,,,tea house,,,gratin,,,Bushkill
1110,Book a restaurant that serves bouchée for midnight .,,,,midnight,,,,restaurant,,,bouchée,,,
1111,Book a restaurant for 7 people.,7,,,,,,,restaurant,,,,,,
1112,party of two for a food truck on december 22 that serves chicken french in Bolivia,two,,,december 22,,Bolivia,,food truck,,,chicken french,,,
1113,"book a spot for marlene, jordan and I on oct. the 6th",,,,oct. the 6th,,,"marlene, jordan and I",,,,,,,
1114,book a restaurant that serves trottole in Tillicum,,,,,,,,restaurant,,,trottole,,,Tillicum
1115,I'd like to book the best  restaurant in AS .,,,,,best,,,restaurant,,,,AS,,
1116,book a spot for 10  in the same area of Inwood - 207th St,10,in the same area,,,,,,,,,,,Inwood - 207th St,
1117,"I need to book a restaurant in Burkettsville  in 2 years for rhoda adams, roxanne and I",,,,in 2 years,,,"rhoda adams, roxanne and I",restaurant,,,,,,Burkettsville
1118,Need a table at a fast food restaurant for me and my kids in Brusly Landing,,,,,,,me and my kids,fast food restaurant,,,,,,Brusly Landing
1119,I need a table for nine in Atlas  in 1 second,nine,,,in 1 second,,,,,,,,,,Atlas
1120,Book a restaurant  distant from downtown .,,distant,,,,,,restaurant,,,,,downtown,
1121,I want to bring four people to a place that's close to downtown that serves churrascaria cuisine.,four,close,,,,,,churrascaria,,,,,downtown,
1122,in Delanson  1 hour from now reserve a table for four,four,,,1 hour from now,,,,,,,,,,Delanson
1123,Find me a table at a delicatessen in Urbanette that serves rabbit pie,,,,,,,,delicatessen,,,rabbit pie,,,Urbanette
1124,Book a restaurant in WI at 13:22:34 for 9 people.,9,,,13:22:34,,,,restaurant,,,,WI,,
1125,Please make reservations for three at a kosher  taverna  nearby  our secondary residence ,three,nearby,,,,,,taverna,,kosher,,,our secondary residence,
1126,"Book a restaurant in Indiana for me, violet and dianne .",,,,,,,"me, violet and dianne",restaurant,,,,Indiana,,
1127,book a restaurant  close to Grant Av,,close,,,,,,restaurant,,,,,Grant Av,
1128,Book reservation for 2 people tomorrow in Whitewater,2,,,tomorrow,,,,,,,,,,Whitewater
1129,I need a table for 8 people at a restaurant in District Of Columbia .,8,,,,,,,restaurant,,,,District Of Columbia,,
1130,book a table for ten people,ten,,,,,,,,,,,,,
1131,Book a restaurant for 9 at 00:37 PM,9,,,00:37 PM,,,,restaurant,,,,,,
1132,Book a restaurant in Botswana for seven people.,seven,,,,,Botswana,,restaurant,,,,,,
1133,Book Georgetown Cupcake in Keller for tea time.,,,,tea,,,,,Georgetown Cupcake,,,,,Keller
1134,"Book a restaurant for marcella, erma and leanne rivera .",,,,,,,"marcella, erma and leanne rivera",restaurant,,,,,,
1135,I would like to make a reservation for 2 for brunch .,2,,,brunch,,,,,,,,,,
1136,Book a table for me and my crew scheduled for 10:47:15 pm in IL .,,,,10:47:15 pm,,,me and my crew,,,,,IL,,
1137,I'd like to go to the popular  bistro in OH,,,,,popular,,,bistro,,,,OH,,
1138,Please book a bar type goiano room accommodate for 2 members 1 second from now in PR,2,,,1 second from now,,,,bar,,goiano,,PR,,
1139,I'm looking to get a seat at a brasserie in Togo .,,,,,,Togo,,brasserie,,,,,,
1140,Book me a table at a Tartinery Restaurant  not far from my home in Elk Rapids .,,not far,,,,,,,Tartinery Restaurant,,,,home,Elk Rapids
1141,"book a brasserie at Turtle Creek  neighboring on march sixth, 2038 for eight",eight,neighboring,,"march sixth, 2038",,,,brasserie,,,,,Turtle Creek,
1142,Book a maharashtrian  restaurant please.,,,,,,,,restaurant,,maharashtrian,,,,
1143,Book a table for five in Unalaska  this month .,five,,,this month,,,,,,,,,,Unalaska
1144,"My party of 3 would really like to eat baba au rhum at a brasserie , could you help?",3,,,,,,,brasserie,,,baba au rhum,,,
1145,I want to book a restaurant  now in Ludlow for eight,eight,,,now,,,,restaurant,,,,,,Ludlow
1146,I want to book a pub in MS that serves festoni,,,,,,,,pub,,,festoni,MS,,
1147,book a cafe in Romania,,,,,,Romania,,cafe,,,,,,
1148,I want to take my parents and I to eat some romagna at a brasserie in North Dakota,,,,,,,my parents and I,brasserie,,romagna,,North Dakota,,
1149,"Book a table for 1 , 1 second from now in Adelaide",1,,,1 second from now,,,,,,,,,,Adelaide
1150,in one hundred twenty seven days I'd like to eat at a pizzeria in North Lima,,,,in one hundred twenty seven days,,,,pizzeria,,,,,,North Lima
1151,Book a brasserie in Cuney for seven people.,seven,,,,,,,brasserie,,,,,,Cuney
1152,"Book me a table for seven in Co-operative Block Building , ND .",seven,,,,,,,,Co-operative Block Building,,,ND,,
1153,I'd like to eat surf and turf  in one minute at a bar,,,,in one minute,,,,bar,,,surf and turf,,,
1154,I want to take my mom and I to the tea house,,,,,,,my mom and I,tea house,,,,,,
1155,I want to book a highly rated  pizzeria  in the same area as tia's house,,in the same area,,,highly rated,,,pizzeria,,,,,tia's house,
1156,I need a table at The Middle East in MN for a party of 6,6,,,,,,,,The Middle East,,,MN,,
1157,book me a restaurant at Sint Maarten on sun .,,,,sun,,Sint Maarten,,restaurant,,,,,,
1158,Book a restaurant in Three Points,,,,,,,,restaurant,,,,,,Three Points
1159,I want a table for 2 at a Portugal  restaurant,2,,,,,Portugal,,restaurant,,,,,,
1160,I'd like to eat at an internet  restaurant with a party of four,four,,internet,,,,,restaurant,,,,,,
1161,I would like to book a bistro for 7,7,,,,,,,bistro,,,,,,
1162,I'd like to eat at a restaurant in MD with a party of 8,8,,,,,,,restaurant,,,,MD,,
1163,Find a reservation for 2 at a restaurant for pizza,2,,,,,,,restaurant,,,pizza,,,
1164,I want to book a restaurant in Bosnia and Herzegovina .,,,,,,Bosnia and Herzegovina,,restaurant,,,,,,
1165,Need a booking for a party of five at a restaurant in French Polynesia,five,,,,,French Polynesia,,restaurant,,,,,,
1166,Book reservation at The Big Chill Cafe in AR for 10 people,10,,,,,,,,The Big Chill Cafe,,,AR,,
1167,Make me reservations for a highly rated  restaurant .,,,,,highly rated,,,restaurant,,,,,,
1168,book a restaurant for my baby and I in Delaware,,,,,,,my baby and I,restaurant,,,,Delaware,,
1169,Book a table at the top-rated  taverna in North Korea .,,,,,top-rated,North Korea,,taverna,,,,,,
1170,Book reservations at a restaurant in Jersey for six people next October,six,,,next October,,Jersey,,restaurant,,,,,,
1171,book a cafe table for one that has internet access,one,,internet,,,,,cafe,,,,,,
1172,I'd like to eat at a restaurant  far from Grantsburg,,far,,,,,,restaurant,,,,,,Grantsburg
1173,"Book a table at a tavern in Albania for annette, darlene and barbara james for ten AM",,,,ten AM,,Albania,"annette, darlene and barbara james",tavern,,,,,,
1174,Book a restaurant in Swaziland  in 1 hour .,,,,in 1 hour,,Swaziland,,restaurant,,,,,,
1175,"Book me a reservation for an osteria  campanian on Jun. the 7th, 2022",,,,"Jun. the 7th, 2022",,,,osteria,,campanian,,,,
1176,Book a reservation for me and my step sister in Nebraska  in two seconds,,,,in two seconds,,,me and my step sister,,,,,Nebraska,,
1177,Book the Coon Chicken Inn in Baker City for 4 people.,4,,,,,,,,Coon Chicken Inn,,,,,Baker City
