,text,party_size_number,spatial_relation,facility,timeRange,sort,country,party_size_description,restaurant_type,restaurant_name,cuisine,served_dish,state,poi,city
1412,Find a reservation in Deweese for my sister and I,,,,,,,my sister and I,,,,,,,Deweese
1413,I'd like a restaurant on 6/1/2027 for 5 people in Iowa City,5,,,6/1/2027,,,,restaurant,,,,,,Iowa City
1414,book a table near  Bienville for Pioneer Day,,near,,Pioneer Day,,,,,,,,,,Bienville
1415,I need a table at the close  restaurant for my niece and I at the Brooklyn Bridge-City Hall .,,close,,,,,my niece and I,restaurant,,,,,Brooklyn Bridge-City Hall,
1416,book a restaurant for 7 in MN,7,,,,,,,restaurant,,,,MN,,
1417,"I'd like to book a brasserie in Virginia City , GA .",,,,,,,,brasserie,,,,GA,,Virginia City
1418,book a spot at a restaurant  within walking distance of Palau,,within walking distance,,,,,,restaurant,,,,Palau,,
1419,I would like reservations for Giodi's in Piper  AZ .,,,,,,,,,,,,AZ,,Piper
1420,Book me a table for a party of eight in Germany .,eight,,,,,Germany,,,,,,,,
1421,book a table for me and savannah in Lauderdale Lakes,,,,,,,me and savannah,,,,,,,Lauderdale Lakes
1422,Book a highly rated  fast food restaurant in Falmouth .,,,,,highly rated,,,fast food restaurant,,,,,,Falmouth
1423,book a spot for two at a churrascaria that sells cupcake in Lumpkin  Indiana  now,two,,,now,,,,churrascaria,,,cupcake,Indiana,,Lumpkin
1424,Book me seats for 6 at the best  brasserie that serves marche  neighboring  my hostel,6,neighboring,,,best,,,brasserie,,marche,,,my hostel,
1425,Book reservations at a north indian  bar for 4 people,4,,,,,,,bar,,north indian,,,,
1426,book me a restaurant that is close for four people in Enid,four,close,,,,,,restaurant,,,,,,Enid
1427,book a restaurant in Montverde in Marshall Islands,,,,,,,,restaurant,,,,Marshall Islands,,Montverde
1428,Get me a table for 5 at a restaurant which serves south tyrolean .,5,,,,,,,restaurant,,south tyrolean,,,,
1429,Make me a reservation in Colorado at nine am at National Cash Register Building,,,,nine am,,,,,National Cash Register Building,,,Colorado,,
1430,Book me a restaurant in Cyprus at a pub,,,,,,Cyprus,,pub,,,,,,
1431,Book the Last Exit on Brooklyn  5 hours from now for one person.,one,,,5 hours from now,,,,,Last Exit on Brooklyn,,,,,
1432,I'd like to eat at the Original Spanish Kitchen in North Carolina,,,,,,,,,Original Spanish Kitchen,,,North Carolina,,
1433,"Book the best  cafe on Jan. 18th, 2035 .",,,,"Jan. 18th, 2035",best,,,cafe,,,,,,
1434,I need a table for 4 in Pelland,4,,,,,,,,,,,,,Pelland
1435,I want to book a tea house for 4 that serves madeleine,4,,,,,,,tea house,,,madeleine,,,
1436,Book The Electric Banana in Ewen for crystal and brittney .,,,,,,,crystal and brittney,,The Electric Banana,,,,,Ewen
1437,I want a table for five at a restaurant with latin food in Arkansas for 1 hour from now,five,,,1 hour from now,,,,restaurant,,latin,,Arkansas,,
1438,"book a table for 10 at The Dome, Edinburgh",10,,,,,,,,"The Dome, Edinburgh",,,,,
1439,"Coon Chicken Inn  restaurant for 1 am for me, clarice and debbie",,,,1 am,,,"me, clarice and debbie",restaurant,Coon Chicken Inn,,,,,
1440,book a table for seven during our Thailand trip that is within walking distance of our hotel.,seven,within walking distance,,,,Thailand,,,,,,,,
1441,Please book a restaurant for nine members on august 25 in DC,nine,,,august 25,,,,restaurant,,,,DC,,
1442,Book a restaurant at sixteen o'clock in SC,,,,sixteen o'clock,,,,restaurant,,,,SC,,
1443,book a pub for helen and miriam in nine years from now,,,,nine years from now,,,helen and miriam,pub,,,,,,
1444,I need a reservation for Cashel Palace Hotel in California for a party of 9,9,,,,,,,,Cashel Palace Hotel,,,California,,
1445,I'd like to eat with a party of 8 in Hitchita  OR,8,,,,,,,,,,,OR,,Hitchita
1446,book a table for my step father and I,,,,,,,my step father and I,,,,,,,
1447,I'd like a table for 6 at a restaurant in Denmark at 22,6,,,22,,Denmark,,restaurant,,,,,,
1448,book a bistro for 4 at sunset,4,,,sunset,,,,bistro,,,,,,
1449,I need a reservation at The One Eighty for elsa and wendy in Muscle Shoals .,,,,,,,elsa and wendy,,The One Eighty,,,,,Muscle Shoals
1450,book a brasserie for one,one,,,,,,,brasserie,,,,,,
1451,"I would like to book at a pub on mar. 8, 2020 that is close to Broadway-Lafayette St for my daughters and I .",,close,,"mar. 8, 2020",,,my daughters and I,pub,,,,,Broadway-Lafayette St,
1452,"I need a top-rated  gastropub for 5 in DC in Conshohocken on Jul. the 18th, 2024",5,,,"Jul. the 18th, 2024",top-rated,,,gastropub,,,,DC,,Conshohocken
1453,book a table in Fleetwood at a nearby deli,,nearby,,,,,,,,,,,Fleetwood,
1454,book in Southern Shores for 8 at Ariston Cafe,8,,,,,,,,Ariston Cafe,,,,,Southern Shores
1455,Book a table at the WWE The World in South Korea .,,,,,,South Korea,,,WWE The World,,,,,
1456,Book table on the 23 in Illinois at the Maison Parthenais-Perrault II .,,,,23,,,,,Maison Parthenais-Perrault II,,,Illinois,,
1457,Book a reservation for eight people in North Dakota,eight,,,,,,,,,,,North Dakota,,
1458,book for 3 in U.S. Virgin Islands,3,,,,,U.S. Virgin Islands,,,,,,,,
1459,"hannah lewis and chelsea want to go to a cafe in Botswana on Apr. the seventeenth, 2024",,,,"Apr. the seventeenth, 2024",,Botswana,hannah lewis and chelsea,cafe,,,,,,
1460,"book a latin cuisine pub for 2 on September the 13th, 2037 in Kazakhstan",2,,,"September the 13th, 2037",,Kazakhstan,,pub,,latin,,,,
1461,"I want to bring antoinette, christine and caitlin to get bread at a restaurant in faraway  Connecticut",,faraway,,,,,"antoinette, christine and caitlin",restaurant,,,bread,Connecticut,,
1462,Book the tea house on North River,,,,,,,,tea house,,,,,,North River
1463,I want to eat at a food truck  this week with my colleague and I,,,,this week,,,my colleague and I,food truck,,,,,,
1464,I need a table for 9,9,,,,,,,,,,,,,
1465,Book a table for 10 people on bunker hill day at a food court which serves spätzle in Monaco,10,,,bunker hill day,,Monaco,,food court,,,spätzle,,,
1466,Book a reservation for restaurant in Texas,,,,,,,,restaurant,,,,Texas,,
1467,I want a table for four at a place in California,four,,,,,,,,,,,California,,
1468,book a spot for 3 at the pizza place,3,,,,,,,,,,pizza,,,
1469,book a spot for 6 at a tea house in Tokelau,6,,,,,Tokelau,,tea house,,,,,,
1470,"Book a restaurant with a pool with alta, deborah and bertha in IA .",,,pool,,,,"alta, deborah and bertha",restaurant,,,,IA,,
1471,Book a restaurant for one in AL .,one,,,,,,,restaurant,,,,AL,,
1472,Book a table for 2 at the Seward Community Cafe  within the same area in Shabbona,2,within the same area,,,,,,,Seward Community Cafe,,,,,Shabbona
1473,Book a table at a bar in Cambodia that serves cheese fries .,,,,,,Cambodia,,bar,,,cheese fries,,,
1474,I want a table for 4 in Florida,4,,,,,,,,,,,Florida,,
1475,book a carolina style  restaurant in North Korea for my grandkid and I,,,,,,North Korea,my grandkid and I,restaurant,,,carolina style,,,
1476,book a table at a top-rated  brasserie in Pakistan,,,,,top-rated,Pakistan,,brasserie,,,,,,
1477,I want to book a restaurant for 6 on january third  within walking distance of Northvale,6,within walking distance,,january third,,,,restaurant,,,,,Northvale,
1478,I would like to book the best  southeastern brazilian  food court ,,,,,best,,,food court,,southeastern brazilian,,,,
1479,Book a reservation for six people at a churrascaria restaurant in Cook Islands  one minute from now,six,,,one minute from now,,Cook Islands,,churrascaria restaurant,,,,,,
1480,I need a party of 4 to get a table reserved at a pub with southeastern cuisine.,4,,,,,,,pub,,southeastern,,,,
1481,book at Beardslee Castle in Fairview Lanes for fifteen o'clock,,,,fifteen o'clock,,,,,Beardslee Castle,,,,,Fairview Lanes
1482,I need a reservation for the smoking room at a fast food place for 8 people,8,,smoking room,,,,,fast food,,,,,,
1483,book me a restaurant in the Northern Mariana Islands,,,,,,,,restaurant,,,,Northern Mariana Islands,,
1484,book a food truck in Nisswa for 4 at 5 pm,4,,,5 pm,,,,food truck,,,,,,Nisswa
1485,I want to book the Clarke Cooke House in Uzbekistan,,,,,,Uzbekistan,,,Clarke Cooke House,,,,,
1486,party of four somewhere in SD,four,,,,,,,,,,,SD,,
1487,Find me a coffeehouse for nine in Indiana that has access to a pool,nine,,pool,,,,,coffeehouse,,,,Indiana,,
1488,I want to book an indonesian  food truck .,,,,,,,,food truck,,indonesian,,,,
1489,I'd like to eat souvlaki  fast food with a party of two,two,,,,,,,fast food,,,souvlaki,,,
1490,I need a table for 5 at a brasserie that has a reuben sandwich,5,,,,,,,brasserie,,,reuben sandwich,,,
1491,Book a reservation for three at a top-rated  sicilian  restaurant in Portugal,three,,,,top-rated,Portugal,,restaurant,,sicilian,,,,
1492,book a restaurant for 2 that has internet,2,,internet,,,,,restaurant,,,,,,
1493,Get me a table for 3  within walking distance from my hotel in Tajikistan .,3,within walking distance,,,,Tajikistan,,,,,,,,
1494,I'm looking for a churrascaria place with wifi that can serve a party of five .,five,,wifi,,,,,churrascaria,,,,,,
1495,book John Pearson Soda Works  restaurant on 7/27/2036,,,,7/27/2036,,,,restaurant,John Pearson Soda Works,,,,,
1496,"I need a table at a restaurant serving carne pizzaiola for tamra davis, viola and dorothea",,,,,,,"tamra davis, viola and dorothea",restaurant,,,carne pizzaiola,,,
1497,"I need a reservation for Arcadian Court on June the fifth, 2035",,,,"June the fifth, 2035",,,,,Arcadian Court,,,,,
1498,John Ross House  restaurant  in town and close-by,,close-by,,,,,,restaurant,John Ross House,,,,in town,
1499,make a reservation at a bakery that has acquacotta in Central African Republic for five ,five,,,,,Central African Republic,,bakery,,,acquacotta,,,
1500,Book me a table for 8 at a restaurant for seven pm,8,,,seven pm,,,,restaurant,,,,,,
1501,Book me a table at a hungarian  delicatessen in North Dakota .,,,,,,,,delicatessen,,hungarian,,North Dakota,,
1502,"Reserve a spot at indoor  restaurant on june the 15th , 3 guests",3,,indoor,june the 15th,,,,restaurant,,,,,,
1503,Book a popular  brasserie in Roads End,,,,,popular,,,brasserie,,,,,,Roads End
1504,I need reservations for next autumn in Belgium at a highly rated  diner .,,,,next autumn,highly rated,Belgium,,diner,,,,,,
1505,Find a table for two in a place not far in Culdesac,two,not far,,,,,,,,,,,,Culdesac
1506,Please make reservations for 4 for the hog fry from the food truck,4,,,,,,,food truck,,,hog fry,,,
1507,book a spot for one at The Wolseley at elevenses,one,,,elevenses,,,,,The Wolseley,,,,,
1508,"I need a table for me, violet and maude at a restaurant in NE ",,,,,,,"me, violet and maude",restaurant,,,,NE,,
1509,I want to eat at a indoor  bar for two,two,,indoor,,,,,bar,,,,,,
1510,Can you reserve a table within the same area as the AMerican Samoa for me and my mom,,within the same area,,,,,me and my mom,,,,,AMerican Samoa,,
1511,Let me get reservations for a party of three at a bar with a pool .,three,,pool,,,,,bar,,,,,,
1512,Set me up with a table at a bar with salade for 5,5,,,,,,,bar,,,salade,,,
1513,I want seats for 4 at a Sichuan Food  restaurant in Indonesia,4,,,,,Indonesia,,restaurant,Sichuan Food,,,,,
1514,Can you get me seating at a pub in South Korea that serves milk toast for supper,,,,supper,,South Korea,,pub,,,milk toast,,,
1515,Take me a top-rated  restaurant for nine  close to Westfield  Delaware,nine,close,,,top-rated,,,restaurant,,,,Delaware,,Westfield
1516,"Book a restaurant that serves meze in Roseville  FL with meredith, louisa and corrine .",,,,,,,"meredith, louisa and corrine",restaurant,,,meze,FL,,Roseville
1517,I want to book the best  manadonese  restaurant for six at 21:49 that is distant from my baby's work ,six,distant,,21:49,best,,,restaurant,,manadonese,,,my baby's work,
1518,book a taverna for me and jami,,,,,,,me and jami,taverna,,,,,,
1519,I want to find a salami  restaurant in Bastian  IN,,,,,,,,restaurant,,,salami,IN,,Bastian
1520,Book a reservation for seven people at Fraser Mansion in IL,seven,,,,,,,,Fraser Mansion,,,IL,,
1521,"I need a restaurant booking for 2 people this month at a indian place in Climax Springs , New Mexico .",2,,,this month,,,,restaurant,,indian,,New Mexico,,Climax Springs
1522,Please book a room in The River Café  restaurant to accommodate eight members in Andorra,eight,,,,,Andorra,,restaurant,The River Café,,,,,
1523,I want seating for five  near the pool at the pub,five,near,pool,,,,,pub,,,,,,
1524,Book a reservation for a party of six  in the same area as Metropolitan Borough of Bethnal Green,six,in the same area,,,,,,,,,,,Metropolitan Borough of Bethnal Green,
1525,Book me a reservation for an outdoor  restaurant,,,outdoor,,,,,restaurant,,,,,,
1526,book me a top-rated  pub,,,,,top-rated,,,pub,,,,,,
1527,melba and I want to dine in Barbados  next Jun.,,,,next Jun.,,Barbados,melba and I,,,,,,,
1528,I need to book a restaurant for eight  nearby  Limerick  one year from now that serves jerky ,eight,nearby,,one year from now,,,,restaurant,,,jerky,,,Limerick
1529,I need a table for six  near the Russia  bistro that has wifi,six,near,wifi,,,Russia,,bistro,,,,,,
1530,"at two am , I need reservations for my friends and I at Irma Hotel .",,,,two am,,,my friends and I,,Irma Hotel,,,,,
1531,I need to reserve a seat for one in SD at a brasserie restaurant .,one,,,,,,,brasserie restaurant,,,,SD,,
1532,Book COVA in Frisco City for me and therese at eight pm,,,,eight pm,,,me and therese,,COVA,,,,,Frisco City
1533,"I want to find a highly rated  delicatessen in Childersburg , DE for one  next February",one,,,next February,highly rated,,,delicatessen,,,,DE,,Childersburg
1534,Book a reservation for my great grandfather and I at a macaroni  pub in CT,,,,,,,my great grandfather and I,pub,,,macaroni,CT,,
1535,"Can I get a restaurant reserved in Luquillo , District Of Columbia ?",,,,,,,,restaurant,,,,District Of Columbia,,Luquillo
1536,i need a table at a close by restaurnt in Hackney for ten,ten,close by,,,,,,,,,,,Hackney,
1537,Book a table for three at a middle eastern  gastropub,three,,,,,,,gastropub,,middle eastern,,,,
1538,I'd like to eat at The Firehouse Restaurant,,,,,,,,,The Firehouse Restaurant,,,,,
1539,I'd like to eat at a popular  diner,,,,,popular,,,diner,,,,,,
1540,Make me a reservation for july the tenth at The Nosh Bar for a party of two,two,,,july the tenth,,,,,The Nosh Bar,,,,,
1541,I need to book a restaurant that has wifi  far from TX for me and my parents,,far,wifi,,,,me and my parents,restaurant,,,,TX,,
1542,Book a restaurant in San Juan Capistrano for 6 people at ten am,6,,,ten am,,,,restaurant,,,,,,San Juan Capistrano
1543,need to book a table in Ludden,,,,,,,,,,,,,,Ludden
1544,Book reservation at a restaurant in Rocky Fork for 2 people,2,,,,,,,restaurant,,,,,,Rocky Fork
1545,I would like a cafeteria at 10:41:51 am for seven,seven,,,10:41:51 am,,,,cafeteria,,,,,,
1546,book a restaurant in Lake Fenton for four ,four,,,,,,,restaurant,,,,,,Lake Fenton
1547,book a spot for 3 at a bar in Antarctica,3,,,,,Antarctica,,bar,,,,,,
1548,I'd like to eat at a highly rated  pub with 6 people,6,,,,highly rated,,,pub,,,,,,
1549,What is the best  restaurant in Kentucky for ten at 0 am,ten,,,0 am,best,,,restaurant,,,,Kentucky,,
1550,book for 10 in a restaurant,10,,,,,,,restaurant,,,,,,
1551,I want a table for eight at GU,eight,,,,,,,,,,,GU,,
1552,Book a brasserie type restaurant that serves pizzas in AMerican Samoa,,,,,,,,restaurant,,,pizzas,AMerican Samoa,,
1553,"I'm craving mac and cheese . Book a table at a Portland Mills , KS  restaurant . I need it for one second from now",,,,one second from now,,,,restaurant,,,mac and cheese,KS,,Portland Mills
1554,Book a table for 2 at a nearby  restaurant .,2,nearby,,,,,,restaurant,,,,,,
1555,"I need a reservation for claudine, kelsey and shelley at a restaurant in Palestine .",,,,,,Palestine,"claudine, kelsey and shelley",restaurant,,,,,,
1556,Need to book a restaurnt for a party of nine on Thomas Jefferson's Birthday ,nine,,,Thomas Jefferson's Birthday,,,,,,,,,,
1557,"this winter , meredith, betty and erika want to food at a gastropub that is in the same area as fran's location .",,in the same area,,this winter,,,"meredith, betty and erika",gastropub,,,,,fran's location,
1558,Book a reservation for my parents and I at Red Crown Tourist Court in Slovakia,,,,,,Slovakia,my parents and I,,Red Crown Tourist Court,,,,,
1559,I want to book a spot at the local food court,,,,,,,,food court,,,,,,
1560,Locate a cafeteria for two that serves deviled crab,two,,,,,,,cafeteria,,,deviled crab,,,
1561,Book a food court in Raytown  Arizona that serves green bean casserole on july 20th .,,,,july 20th,,,,food court,,,green bean casserole,Arizona,,Raytown
1562,Book me seats for 6 at a restaurant in WV  in one second,6,,,in one second,,,,restaurant,,,,WV,,
1563,"Please book me a table for 6 people at Top of the Mark in Raleigh Hills , Kentucky",6,,,,,,,,Top of the Mark,,,Kentucky,,Raleigh Hills
1564,Book me a pub  nine weeks from now for 4 people.,4,,,nine weeks from now,,,,pub,,,,,,
1565,book a restaurant in Macedonia for 13 hours from now,,,,13 hours from now,,Macedonia,,restaurant,,,,,,
1566,Book a restaurant with internet in NY for four people.,four,,internet,,,,,restaurant,,,,NY,,
1567,"book a spot for wilma, gay and I At The Gowanus Yacht Club in Montenegro",,,,,,Montenegro,"wilma, gay and I",,The Gowanus Yacht Club,,,,,
1568,"therese, clara and I want to go to the Tennessee Ridge",,,,,,,"therese, clara and I",,,,,,,Tennessee Ridge
1569,"book a gastropub that serves pansette in Skaneateles , Pennsylvania",,,,,,,,gastropub,,,pansette,Pennsylvania,,Skaneateles
1570,Book me a table at The Goof for a party of eight in the state of NV,eight,,,,,,,,The Goof,,,NV,,
1571,Book me a restaurant in Henlopen Acres for a party of two .,two,,,,,,,restaurant,,,,,,Henlopen Acres
1572,book a table in the United States for 10 at The Berghoff,10,,,,,United States,,,The Berghoff,,,,,
1573,Book a restaurant at Tennessee,,,,,,,,restaurant,,,,Tennessee,,
1574,I would like to book a donut serving delicatessen in Cuba for 5 on april eleventh,5,,,april eleventh,,Cuba,,delicatessen,,,donut,,,
1575,Book a restaurant in Palestine for 8 people at 9 AM,8,,,9 AM,,Palestine,,restaurant,,,,,,
1576,"Book a table at the Eighth Step Coffee House that isn't too far from Vineyard Haven for candace phillips, debbie and sondra",,far,,,,,"candace phillips, debbie and sondra",,Eighth Step Coffee House,,,,,Vineyard Haven
1577,reserve a table at Bear Hotel  around  Finsbury Park,,around,,,,,,,Bear Hotel,,,,Finsbury Park,
1578,book australian food in Armour for 7 pm for four at a pub  best rated in UT,four,,,7 pm,best rated,,,pub,,australian,,UT,,Armour
1579,Get me a table for 2 people 1 second from now in Tunisia .,2,,,1 second from now,,Tunisia,,,,,,,,
1580,"I need to book a table at Bridge Round House in South Dakota for me, emily and gena",,,,,,,"me, emily and gena",,Bridge Round House,,,South Dakota,,
1581,book a brasserie for 3,3,,,,,,,brasserie,,,,,,
1582,I'd like to go to a cuban  restaurant in Horatio and get a table for 1,1,,,,,,,restaurant,,cuban,,,,Horatio
1583,Book a restaurant for 9 people.,9,,,,,,,restaurant,,,,,,
1584,Reserve me a table for 10 at a MT  cafe for breakfast .,10,,,breakfast,,,,,cafe,,,MT,,
1585,"Make a reservation in a popular  sicilian  bar place nearby , for me only, tomorrow",,nearby,,tomorrow,popular,,,bar,,sicilian,,,,
1586,Book a restaurant for a party of 7 in Paraguay on Saturday,7,,,Saturday,,Paraguay,,restaurant,,,,,,
1587,I need to book a table at a nearby  restaurant,,nearby,,,,,,restaurant,,,,,,
1588,I want to make a reservation at the Conflict Kitchen for one ,one,,,,,,,,Conflict Kitchen,,,,,
1589,"Book a table at Central Grocery on Mar. 22nd, 2020",,,,"Mar. 22nd, 2020",,,,,Central Grocery,,,,,
1590,I'd like to book a place to eat in NY .,,,,,,,,,,,,NY,,
1591,Book a restaurant with pool facility at East Gillespie,,,pool,,,,,restaurant,,,,,,East Gillespie
1592,"Book a reservation for 7 people at The French Laundry on june the 8th, 2029",7,,,"june the 8th, 2029",,,,,The French Laundry,,,,,
1593,Book a brasserie in the Falkland Islands for this week .,,,,this week,,Falkland Islands,,brasserie,,,,,,
1594,Can you get me seating for 5 at a highly rated  restaurant in Wisconsin,5,,,,highly rated,,,restaurant,,,,Wisconsin,,
1595,my sons and I want to dine at The Water Club in Georgia,,,,,,,my sons and I,,The Water Club,,,Georgia,,
1596,Book me a popular  restaurant reservation at a brazilian  delicatessen,,,,,popular,,,delicatessen,,brazilian,,,,
1597,book a spot at a restaurant with trattoria in Otho  DE,,,,,,,,restaurant,,trattoria,,DE,,Otho
1598,I need a reservation for two at a diner in Venezuela,two,,,,,Venezuela,,diner,,,,,,
1599,Book a restaurant  far from Kokomo  this fall .,,far,,this fall,,,,restaurant,,,,,,Kokomo
1600,"I'd like to book at a place in AR , looking for an oyster bar that is indoor and can accommodate a party of eight that is also within walking distance .",eight,within walking distance,indoor,,,,,oyster bar,,,,AR,,
1601,Book me a table for me and my nephew  near  my location at an indoor  pub,,near,indoor,,,,me and my nephew,pub,,,,,my location,
1602,I want to book a table for me and josefa at Jacob Wirth Restaurant in Branford .,,,,,,,me and josefa,,Jacob Wirth Restaurant,,,,,Branford
1603,I need a reservation for nine at 03:44 am in WI,nine,,,03:44 am,,,,,,,,WI,,
1604,Book Nuts on Clark in Irvington for 8 people in one hour .,8,,,in one hour,,,,,Nuts on Clark,,,,,Irvington
1605,food truck in Panama for five,five,,,,,Panama,,food truck,,,,,,
1606,"book me a restaurant that serves hot chicken in Dutch Mills , North Dakota for 10 people for 3 am",10,,,3 am,,,,restaurant,,,hot chicken,North Dakota,,Dutch Mills
1607,Make a reservation for eunice thompson and elisa martin in the Virgin Islands  in one minute .,,,,in one minute,,,eunice thompson and elisa martin,,,,,Virgin Islands,,
1608,book a spot for ten in MS,ten,,,,,,,,,,,MS,,
1609,"Book a brasserie restaurant in Enfield , North Dakota for rosie and I that has tarte tatin",,,,,,,rosie and I,brasserie restaurant,,,tarte tatin,North Dakota,,Enfield
1610,book for two in Jordan that is close,two,close,,,,Jordan,,,,,,,,
1611,I need a table for 3 in AK .,3,,,,,,,,,,,AK,,
1612,I need a reservation for 6 at Cherwell Boathouse .,6,,,,,,,,Cherwell Boathouse,,,,,
1613,book a spot at a soul food  food truck in Cawker City,,,,,,,,food truck,,,soul food,,,Cawker City
1614,book a spot for 9 in New Mexico,9,,,,,,,,,,,New Mexico,,
1615,Book me a table for 4 in a restaurant in United Kingdom .,4,,,,,United Kingdom,,restaurant,,,,,,
1616,book a gluten free  restaurant in Arp,,,,,,,,restaurant,,gluten free,,,,Arp
1617,book a spot for one at a bar in Seabrook,one,,,,,,,bar,,,,,,Seabrook
1618,I need a table in TN that's not to far for a party of ten,ten,far,,,,,,,,,,TN,,
1619,I want to eat ice cream at a brasserie with me and my mother in law,,,,,,,me and my mother in law,brasserie,,,ice cream,,,
1620,in twenty three hours and 1 second  my daughter and I want to eat at a restaurant,,,,in twenty three hours and 1 second,,,my daughter and I,restaurant,,,,,,
1621,I need seats for 6 at CHAR No.4 in Georgia,6,,,,,,,,CHAR No.4,,,Georgia,,
1622,Please book me a table for 1 person at a brasserie .,1,,,,,,,brasserie,,,,,,
1623,book a restaurant for cupcakes for ten,ten,,,,,,,restaurant,,,cupcakes,,,
1624,I need a table right now for four in ME,four,,,now,,,,,,,,ME,,
1625,I would like to eat fast food and have a party of two in Kentucky .,two,,,,,,,fast food,,,,Kentucky,,
1626,book a tea house for 6 members with soul food,6,,,,,,,tea house,,soul food,,,,
1627,Book a table for one at the Bear Hotel in Peru,one,,,,,Peru,,,Bear Hotel,,,,,
1628,book a spot for six on October fifth in Mineola,six,,,October fifth,,,,,,,,,,Mineola
1629,"book a table for jasmine, jeannie and leta",,,,,,,"jasmine, jeannie and leta",,,,,,,
1630,I need a reservation for Orthodox Good Friday,,,,Orthodox Good Friday,,,,,,,,,,
1631,Book a food truck in Argusville that has fish chips ,,,,,,,,food truck,,,fish chips,,,Argusville
1632,"book a pub in Santa Claus , New Jersey for the First Day Of Sukkot",,,,First Day Of Sukkot,,,,pub,,,,New Jersey,,Santa Claus
1633,Book me a bar that's highly rated for georgia and I in Burkina,,,,,highly rated,Burkina,georgia and I,bar,,,,,,
1634,book a restaurant for one in Skillman,one,,,,,,,restaurant,,,,,,Skillman
1635,Book a restaurant for 1  in nine weeks ,1,,,in nine weeks,,,,restaurant,,,,,,
1636,book a spot for six at a restaurant in NJ,six,,,,,,,restaurant,,,,NJ,,
1637,book a restaurant for 6,6,,,,,,,restaurant,,,,,,
1638,book a brasserie for seven in West Yellowstone,seven,,,,,,,brasserie,,,,,,West Yellowstone
1639,I need to get a restaurant reserved in SD .,,,,,,,,restaurant,,,,SD,,
1640,Book a restaurant in Darnell .,,,,,,,,restaurant,,,,,,Darnell
1641,book a restaurant in Anguilla for one at National Coney Island,one,,,,,Anguilla,,restaurant,National Coney Island,,,,,
1642,my step aunt and I want to go cheese fries at the tavern,,,,,,,my step aunt and I,tavern,,,cheese fries,,,
1643,Please book a Uncommon Grounds Coffeehouse  restaurant ,,,,,,,,restaurant,Uncommon Grounds Coffeehouse,,,,,
1644,Book a reservation for irene and rosella at The Room in the Elephant in Israel,,,,,,Israel,irene and rosella,,The Room in the Elephant,,,,,
1645,"Book PM Park, Clear Lake, Iowa at 5 am for 6 people.",6,,,5 am,,,,,"PM Park, Clear Lake, Iowa",,,,,
1646,Can you get me a reservation at WWE The World  around  Av U,,around,,,,,,,WWE The World,,,,Av U,
1647,Make me a reservation in Crugers at Marlton Circle for a party of eight,eight,,,,,,,,Marlton Circle,,,,,Crugers
1648,Book a bar that serves ribs for 5 people.,5,,,,,,,bar,,,ribs,,,
1649,I need a restaurant in Indonesia for 7,7,,,,,Indonesia,,restaurant,,,,,,
1650,Table for 8 at a popular  food court,8,,,,popular,,,food court,,,,,,
